<?xml version="1.0" encoding="UTF-8"?>
<contacts xmlns:xsi="http://www.w3.org/2001/XMLSchema-instance"
          xsi:noNamespaceSchemaLocation="schema.xsd">
    <contact>
        <firstname>John</firstname>
        <lastname>Doe</lastname>
        <email>john@doe.com</email>
        <phone-number>123456789</phone-number>
        <link>0</link>
    </contact>
    <contact>
        <firstname>John</firstname>
        <lastname>Doe</lastname>
        <email>john@doe.com</email>
        <phone-number>123456789</phone-number>
        <link>0</link>
    </contact>
    <contact>
        <firstname>John</firstname>
        <lastname>Doe</lastname>
        <email>john@doe.com</email>
        <phone-number>123456789</phone-number>
        <link>0</link>
    </contact>
</contacts>
